[
  {
    "id": "api.admin.analytics.events",
    "file": "src/app/api/admin/analytics/events/route.ts",
    "route": "/api/admin/analytics/events",
    "methods": [
      "GET"
    ],
    "dynamic_segments": [],
    "signals": {
      "uses_cookie_client": false,
      "uses_service_client": false,
      "calls_verify_admin": true,
      "calls_get_user": false,
      "calls_get_session": false,
      "calls_check_ban": false,
      "inline_role_check": false,
      "references_club_members": false,
      "parses_body": false,
      "has_zod": false,
      "sets_cache_control": false,
      "cache_control_values": [],
      "env_vars_referenced": [],
      "env_gated_auth": false,
      "has_try_catch": false,
      "catch_any_count": 0,
      "console_count": 0,
      "as_any_count": 0,
      "tables_referenced": [
        "events",
        "event_popularity_scores"
      ],
      "loc": 109
    },
    "auth_requirement": "admin",
    "role_required": "admin (src/lib/admin.ts verifyAdmin() → users.roles includes \"admin\")",
    "rls_reliance": "partial",
    "service_role_justified": null,
    "personalized": "unknown",
    "cache_policy_today": "unknown",
    "cache_policy_target": "unknown",
    "input_validation": "unknown",
    "test_present": "unknown",
    "dead_or_duplicate": "unknown",
    "expected_status": {
      "anonymous": "unknown",
      "onboarded_student": "unknown",
      "mid_onboarding_student": "unknown",
      "club_member": "unknown",
      "club_owner": "unknown",
      "multi_club_organizer": "unknown",
      "cross_club_attacker": "unknown",
      "admin": "unknown",
      "banned_permanent": "unknown",
      "suspended_active": "unknown",
      "suspension_expired": "unknown",
      "non_mcgill_signin": "unknown",
      "machine_no_credential": "unknown"
    },
    "findings": []
  },
  {
    "id": "api.admin.analytics.users",
    "file": "src/app/api/admin/analytics/users/route.ts",
    "route": "/api/admin/analytics/users",
    "methods": [
      "GET"
    ],
    "dynamic_segments": [],
    "signals": {
      "uses_cookie_client": false,
      "uses_service_client": false,
      "calls_verify_admin": true,
      "calls_get_user": false,
      "calls_get_session": false,
      "calls_check_ban": false,
      "inline_role_check": false,
      "references_club_members": false,
      "parses_body": false,
      "has_zod": false,
      "sets_cache_control": false,
      "cache_control_values": [],
      "env_vars_referenced": [],
      "env_gated_auth": false,
      "has_try_catch": false,
      "catch_any_count": 0,
      "console_count": 0,
      "as_any_count": 0,
      "tables_referenced": [
        "users"
      ],
      "loc": 83
    },
    "auth_requirement": "admin",
    "role_required": "admin (src/lib/admin.ts verifyAdmin() → users.roles includes \"admin\")",
    "rls_reliance": "partial",
    "service_role_justified": null,
    "personalized": "unknown",
    "cache_policy_today": "unknown",
    "cache_policy_target": "unknown",
    "input_validation": "unknown",
    "test_present": "unknown",
    "dead_or_duplicate": "unknown",
    "expected_status": {
      "anonymous": "unknown",
      "onboarded_student": "unknown",
      "mid_onboarding_student": "unknown",
      "club_member": "unknown",
      "club_owner": "unknown",
      "multi_club_organizer": "unknown",
      "cross_club_attacker": "unknown",
      "admin": "unknown",
      "banned_permanent": "unknown",
      "suspended_active": "unknown",
      "suspension_expired": "unknown",
      "non_mcgill_signin": "unknown",
      "machine_no_credential": "unknown"
    },
    "findings": []
  },
  {
    "id": "api.admin.audit-log",
    "file": "src/app/api/admin/audit-log/route.ts",
    "route": "/api/admin/audit-log",
    "methods": [
      "GET"
    ],
    "dynamic_segments": [],
    "signals": {
      "uses_cookie_client": false,
      "uses_service_client": false,
      "calls_verify_admin": true,
      "calls_get_user": false,
      "calls_get_session": false,
      "calls_check_ban": false,
      "inline_role_check": false,
      "references_club_members": false,
      "parses_body": false,
      "has_zod": false,
      "sets_cache_control": false,
      "cache_control_values": [],
      "env_vars_referenced": [],
      "env_gated_auth": false,
      "has_try_catch": false,
      "catch_any_count": 0,
      "console_count": 0,
      "as_any_count": 1,
      "tables_referenced": [
        "admin_audit_log"
      ],
      "loc": 40
    },
    "auth_requirement": "admin",
    "role_required": "admin (src/lib/admin.ts verifyAdmin() → users.roles includes \"admin\")",
    "rls_reliance": "partial",
    "service_role_justified": null,
    "personalized": "unknown",
    "cache_policy_today": "unknown",
    "cache_policy_target": "unknown",
    "input_validation": "unknown",
    "test_present": "unknown",
    "dead_or_duplicate": "unknown",
    "expected_status": {
      "anonymous": "unknown",
      "onboarded_student": "unknown",
      "mid_onboarding_student": "unknown",
      "club_member": "unknown",
      "club_owner": "unknown",
      "multi_club_organizer": "unknown",
      "cross_club_attacker": "unknown",
      "admin": "unknown",
      "banned_permanent": "unknown",
      "suspended_active": "unknown",
      "suspension_expired": "unknown",
      "non_mcgill_signin": "unknown",
      "machine_no_credential": "unknown"
    },
    "findings": []
  },
  {
    "id": "api.admin.calculate-popularity",
    "file": "src/app/api/admin/calculate-popularity/route.ts",
    "route": "/api/admin/calculate-popularity",
    "methods": [
      "POST",
      "GET"
    ],
    "dynamic_segments": [],
    "signals": {
      "uses_cookie_client": false,
      "uses_service_client": false,
      "calls_verify_admin": false,
      "calls_get_user": false,
      "calls_get_session": false,
      "calls_check_ban": false,
      "inline_role_check": false,
      "references_club_members": false,
      "parses_body": false,
      "has_zod": false,
      "sets_cache_control": false,
      "cache_control_values": [],
      "env_vars_referenced": [
        "NEXT_PUBLIC_SUPABASE_URL",
        "SUPABASE_SERVICE_ROLE_KEY",
        "ADMIN_API_KEY"
      ],
      "env_gated_auth": true,
      "has_try_catch": true,
      "catch_any_count": 0,
      "console_count": 6,
      "as_any_count": 0,
      "tables_referenced": [
        "events",
        "event_popularity_scores"
      ],
      "loc": 240
    },
    "auth_requirement": "machine",
    "role_required": "machine secret ADMIN_API_KEY (Authorization: Bearer <secret>); NOT verifyAdmin() despite the /api/admin/ path",
    "rls_reliance": "bypassed",
    "service_role_justified": null,
    "personalized": "unknown",
    "cache_policy_today": "unknown",
    "cache_policy_target": "unknown",
    "input_validation": "unknown",
    "test_present": "unknown",
    "dead_or_duplicate": "unknown",
    "expected_status": {
      "anonymous": "unknown",
      "onboarded_student": "unknown",
      "mid_onboarding_student": "unknown",
      "club_member": "unknown",
      "club_owner": "unknown",
      "multi_club_organizer": "unknown",
      "cross_club_attacker": "unknown",
      "admin": "unknown",
      "banned_permanent": "unknown",
      "suspended_active": "unknown",
      "suspension_expired": "unknown",
      "non_mcgill_signin": "unknown",
      "machine_no_credential": "unknown"
    },
    "findings": []
  },
  {
    "id": "api.admin.clubs.id",
    "file": "src/app/api/admin/clubs/[id]/route.ts",
    "route": "/api/admin/clubs/[id]",
    "methods": [
      "PATCH"
    ],
    "dynamic_segments": [
      "[id]"
    ],
    "signals": {
      "uses_cookie_client": false,
      "uses_service_client": true,
      "calls_verify_admin": true,
      "calls_get_user": false,
      "calls_get_session": false,
      "calls_check_ban": false,
      "inline_role_check": false,
      "references_club_members": true,
      "parses_body": true,
      "has_zod": false,
      "sets_cache_control": false,
      "cache_control_values": [],
      "env_vars_referenced": [],
      "env_gated_auth": false,
      "has_try_catch": true,
      "catch_any_count": 0,
      "console_count": 4,
      "as_any_count": 0,
      "tables_referenced": [
        "clubs",
        "moderation_reviews",
        "users",
        "club_members",
        "notifications"
      ],
      "loc": 229
    },
    "auth_requirement": "admin",
    "role_required": "admin (src/lib/admin.ts verifyAdmin() → users.roles includes \"admin\")",
    "rls_reliance": "bypassed",
    "service_role_justified": "justified",
    "personalized": "unknown",
    "cache_policy_today": "unknown",
    "cache_policy_target": "unknown",
    "input_validation": "unknown",
    "test_present": "unknown",
    "dead_or_duplicate": "unknown",
    "expected_status": {
      "anonymous": "unknown",
      "onboarded_student": "unknown",
      "mid_onboarding_student": "unknown",
      "club_member": "unknown",
      "club_owner": "unknown",
      "multi_club_organizer": "unknown",
      "cross_club_attacker": "unknown",
      "admin": "unknown",
      "banned_permanent": "unknown",
      "suspended_active": "unknown",
      "suspension_expired": "unknown",
      "non_mcgill_signin": "unknown",
      "machine_no_credential": "unknown"
    },
    "findings": []
  },
  {
    "id": "api.admin.clubs",
    "file": "src/app/api/admin/clubs/route.ts",
    "route": "/api/admin/clubs",
    "methods": [
      "GET"
    ],
    "dynamic_segments": [],
    "signals": {
      "uses_cookie_client": false,
      "uses_service_client": false,
      "calls_verify_admin": true,
      "calls_get_user": false,
      "calls_get_session": false,
      "calls_check_ban": false,
      "inline_role_check": false,
      "references_club_members": false,
      "parses_body": false,
      "has_zod": false,
      "sets_cache_control": false,
      "cache_control_values": [],
      "env_vars_referenced": [],